Id,Question,Question Type,Grade Point,Status,Created At,Average Performance
816c3177-962b-430a-af1f-a1c7b5352cfa,I set specific time limits for tasks to maintain productivity.,SINGLE_CHOICE,10,INACTIVE,2025-12-24T07:27:10.777719+00:00,0.0
39614387-ec3e-4f29-b54f-85841394a895,I minimize distractions during focused work periods.,SINGLE_CHOICE,10,INACTIVE,2025-12-24T07:27:10.777652+00:00,0.0
978f88fd-2691-429a-a523-11004cc9a6bb,I allocate time based on task priority.,SINGLE_CHOICE,10,INACTIVE,2025-12-24T07:27:10.777612+00:00,0.0
fd95de6d-f80d-40db-84ca-3026e53eb6ba,I avoid procrastination on important tasks.,SINGLE_CHOICE,10,INACTIVE,2025-12-24T07:27:10.777574+00:00,0.0
7271ea44-8c98-4eff-bbc4-7a956990fbbe,I use calendars or planners to organize my schedule.,SINGLE_CHOICE,10,INACTIVE,2025-12-24T07:27:10.777535+00:00,0.0
c25a2e43-0578-4aa8-a35b-b4de6f42a413,I revise my thinking when presented with new evidence.,SINGLE_CHOICE,10,INACTIVE,2025-12-24T07:27:10.777497+00:00,0.0
9eca4105-3843-47cd-83f0-2e5338474230,I approach complex issues with curiosity and skepticism.,SINGLE_CHOICE,10,INACTIVE,2025-12-24T07:27:10.777458+00:00,0.0
e8eb21b7-985a-4c6f-a343-162de9f27aeb,I can identify the root cause of problems.,SINGLE_CHOICE,10,INACTIVE,2025-12-24T07:27:10.777418+00:00,0.0
dc1f0581-202e-4de6-af8d-d95a556d6d29,I consider potential consequences before making decisions.,SINGLE_CHOICE,10,INACTIVE,2025-12-24T07:27:10.777378+00:00,0.0
a1d36ff7-6e96-4cbd-bd85-04c312093709,I distinguish between facts and opinions in discussions.,SINGLE_CHOICE,10,INACTIVE,2025-12-24T07:27:10.777340+00:00,0.0
c28de8c7-3206-441c-8ae3-b8f5b806d36c,I analyze problems systematically rather than jumping to conclusions.,SINGLE_CHOICE,10,INACTIVE,2025-12-24T07:27:10.777301+00:00,0.0
846d0bd7-fa12-453c-9365-b8fa91097a7c,I can identify logical fallacies in arguments.,SINGLE_CHOICE,10,INACTIVE,2025-12-24T07:27:10.777262+00:00,0.0
423a3ac4-5f88-4d63-a912-4e444d1a76f8,I consider multiple perspectives before forming opinions.,SINGLE_CHOICE,10,INACTIVE,2025-12-24T07:27:10.777224+00:00,0.0
572a04a4-5965-4350-bd9e-191bef6a3998,I evaluate the credibility of information sources.,SINGLE_CHOICE,10,INACTIVE,2025-12-24T07:27:10.777186+00:00,0.0
100afd6d-3446-40ec-8462-b65fa7f1c1c4,I question assumptions before accepting them as truth.,SINGLE_CHOICE,10,INACTIVE,2025-12-24T07:27:10.777146+00:00,0.0
edc283b4-07be-4fd0-a3a1-10f6e443b7c6,I take ownership of my responsibilities and outcomes.,SINGLE_CHOICE,10,INACTIVE,2025-12-24T07:27:10.777106+00:00,0.0
e790c381-b437-4b36-b0f6-832de5e12e75,I continuously look for ways to improve my skills and knowledge.,SINGLE_CHOICE,10,INACTIVE,2025-12-24T07:27:10.777068+00:00,0.0
8a46f97a-8a3e-4516-ba08-6056a062c009,I am reliable and follow through on commitments.,SINGLE_CHOICE,10,INACTIVE,2025-12-24T07:27:10.777029+00:00,0.0
79182d57-66fe-405d-9f2d-3705a2b2f672,I maintain professional behavior in all work contexts.,SINGLE_CHOICE,10,INACTIVE,2025-12-24T07:27:10.776989+00:00,0.0
af79d0e6-554e-4342-a23b-cb60bd4eb3d1,I can work independently without constant supervision.,SINGLE_CHOICE,10,INACTIVE,2025-12-24T07:27:10.776950+00:00,0.0
7f4d6a10-733c-4f0d-a386-217dd8d90539,I go beyond minimum requirements when working on projects.,SINGLE_CHOICE,10,INACTIVE,2025-12-24T07:27:10.776850+00:00,0.0
402e775d-c140-499e-abe5-bf9aaf13ace2,I am punctual for meetings and appointments.,SINGLE_CHOICE,10,INACTIVE,2025-12-24T07:27:10.776811+00:00,0.0
b81618fc-a463-40ff-adc8-161105de5c74,I maintain high standards for the quality of my work.,SINGLE_CHOICE,10,INACTIVE,2025-12-24T07:27:10.776772+00:00,0.0
b69d2347-28f8-49d5-859d-e33570d8d5db,I take initiative without waiting for direction.,SINGLE_CHOICE,10,INACTIVE,2025-12-24T07:27:10.776731+00:00,0.0
ae2ba630-21f8-4c41-9945-71dce903c16f,I consistently meet deadlines for my work.,SINGLE_CHOICE,10,INACTIVE,2025-12-24T07:27:10.776673+00:00,0.0
f7a0cea6-fb02-486a-8d1b-a206005b9c2a,I believe that learning never stops in the technology field.,SINGLE_CHOICE,10,INACTIVE,2025-12-24T07:27:10.776633+00:00,0.0
26693c3a-b965-4feb-9c6f-80167e72b81e,I enjoy teaching others what I have learned.,SINGLE_CHOICE,10,INACTIVE,2025-12-24T07:27:10.776594+00:00,0.0
c8488e73-57ac-49d9-87e4-e1af2af5b9f9,I set personal learning goals beyond academic requirements.,SINGLE_CHOICE,10,INACTIVE,2025-12-24T07:27:10.776543+00:00,0.0
8ac65d96-fd27-4819-bef3-bb2bb1b6a444,I seek feedback to identify areas for improvement.,SINGLE_CHOICE,10,INACTIVE,2025-12-24T07:27:10.776504+00:00,0.0
c9e7bf4f-84fa-412e-8694-7574a3d44140,"I attend tech meetups, conferences, or webinars when possible.",SINGLE_CHOICE,10,INACTIVE,2025-12-24T07:27:10.776465+00:00,0.0
dc110c04-d042-4da5-bbd5-17284bb91788,I experiment with new tools and technologies in personal projects.,SINGLE_CHOICE,10,INACTIVE,2025-12-24T07:27:10.776425+00:00,0.0
32537a71-c686-4fbb-9063-0bf86ea37486,I follow industry leaders and influencers in my field.,SINGLE_CHOICE,10,INACTIVE,2025-12-24T07:27:10.776386+00:00,0.0
728413fd-22b8-4bf1-8878-e7cd3b993044,I participate in online courses or workshops beyond formal education.,SINGLE_CHOICE,10,INACTIVE,2025-12-24T07:27:10.776346+00:00,0.0
f367e09f-48f4-4b19-9c07-110c5c8551f4,I enjoy learning new programming languages or frameworks.,SINGLE_CHOICE,10,INACTIVE,2025-12-24T07:27:10.776306+00:00,0.0
71e4c348-a989-424b-997d-065eb7125137,I regularly read technical articles or blogs to stay updated.,SINGLE_CHOICE,10,INACTIVE,2025-12-24T07:27:10.776267+00:00,0.0
9a26de9e-9c5a-49c6-ba21-7fc72c7c347f,I learn from completed projects to improve future planning.,SINGLE_CHOICE,10,INACTIVE,2025-12-24T07:27:10.776227+00:00,0.0
cd9d33a1-778c-45b3-9b9f-a36857d5468c,I set realistic expectations for what I can accomplish.,SINGLE_CHOICE,10,INACTIVE,2025-12-24T07:27:10.776185+00:00,0.0
a14b4831-cf79-41be-a0d3-02bbd4e1e07d,I can manage multiple projects simultaneously.,SINGLE_CHOICE,10,INACTIVE,2025-12-24T07:27:10.776135+00:00,0.0
1387c5be-c4e3-4314-91f2-2c5e9c2c0b3a,I communicate potential delays or issues proactively.,SINGLE_CHOICE,10,INACTIVE,2025-12-24T07:27:10.776068+00:00,0.0
e70192bc-3428-4b15-b611-56b04c3946be,I use tools or systems to organize my work.,SINGLE_CHOICE,10,INACTIVE,2025-12-24T07:27:10.775943+00:00,0.0
ede74c81-aaae-4d55-ac52-9906919f18e0,I can adjust my plans when unexpected obstacles arise.,SINGLE_CHOICE,10,INACTIVE,2025-12-24T07:27:10.640456+00:00,0.0
0b78c596-5acd-444c-b543-1f638191d029,I regularly track my progress against goals.,SINGLE_CHOICE,10,INACTIVE,2025-12-24T07:27:10.640418+00:00,0.0
f36a63ae-77cb-4bb5-91f0-c31f9375a980,I prioritize tasks based on importance and urgency.,SINGLE_CHOICE,10,INACTIVE,2025-12-24T07:27:10.640380+00:00,0.0
64ca42de-4574-4251-819c-58ae9fa30b5c,I break large projects into manageable phases.,SINGLE_CHOICE,10,INACTIVE,2025-12-24T07:27:10.640341+00:00,0.0
fd65d932-96aa-4252-a5c7-7fea21ae2666,I can estimate how long tasks will take to complete.,SINGLE_CHOICE,10,INACTIVE,2025-12-24T07:27:10.640302+00:00,0.0
a9b4e67e-ee3f-4f22-a120-2c8955d65bc2,I consider the societal impact of technology I help create.,SINGLE_CHOICE,10,INACTIVE,2025-12-24T07:27:10.640263+00:00,0.0
efc43acc-843f-4355-9b71-c45a6c714242,I understand the importance of data ethics and responsible AI practices.,SINGLE_CHOICE,10,INACTIVE,2025-12-24T07:27:10.640225+00:00,0.0
5f5cd540-748e-4402-a3d5-37a8ecc95327,I treat all colleagues with respect and professionalism.,SINGLE_CHOICE,10,INACTIVE,2025-12-24T07:27:10.640185+00:00,0.0
a02cd437-dde7-4526-b065-b484f3662dea,I take responsibility for my mistakes and learn from them.,SINGLE_CHOICE,10,INACTIVE,2025-12-24T07:27:10.640145+00:00,0.0
ff721adf-1e63-403c-810d-983e014ccd79,I adhere to professional standards and codes of conduct.,SINGLE_CHOICE,10,INACTIVE,2025-12-24T07:27:10.640106+00:00,0.0
ec41197d-77fd-4cba-8e1b-4f8d7c590c64,I consider the ethical implications of technical decisions.,SINGLE_CHOICE,10,INACTIVE,2025-12-24T07:27:10.640068+00:00,0.0
faccda50-0f95-4473-ad76-efffad3a7a4f,I am honest about my capabilities and limitations.,SINGLE_CHOICE,10,INACTIVE,2025-12-24T07:27:10.640029+00:00,0.0
1b637002-8aa0-4425-8959-3072ae4a0bc3,I give proper credit to others for their work and ideas.,SINGLE_CHOICE,10,INACTIVE,2025-12-24T07:27:10.639963+00:00,0.0
b57d27d6-dd6a-467d-92c6-a38dd487c80a,I respect confidentiality and privacy in professional settings.,SINGLE_CHOICE,10,INACTIVE,2025-12-24T07:27:10.639919+00:00,0.0
fb89f042-63aa-433d-859b-43a03c47b055,I understand the importance of intellectual property rights.,SINGLE_CHOICE,10,INACTIVE,2025-12-24T07:27:10.639879+00:00,0.0
4c43d528-1923-4b69-9747-c794c4c53678,I view change as an opportunity for growth rather than a threat.,SINGLE_CHOICE,10,INACTIVE,2025-12-24T07:27:10.639841+00:00,0.0
f93e3c00-8a16-48b6-9d7a-f4bc4f7fd3d4,I can work with different team dynamics and personalities.,SINGLE_CHOICE,10,INACTIVE,2025-12-24T07:27:10.639803+00:00,0.0
c119506a-c6cc-420a-afd4-bfecf01c8148,I actively seek out new learning opportunities.,SINGLE_CHOICE,10,INACTIVE,2025-12-24T07:27:10.639764+00:00,0.0
1e625327-30b4-41cb-81bc-083a89766669,I stay calm when faced with unexpected challenges.,SINGLE_CHOICE,10,INACTIVE,2025-12-24T07:27:10.639726+00:00,0.0
30e6d98e-92bd-4fa0-adc1-57ef6c5d0ff6,I can pivot between different tasks and projects efficiently.,SINGLE_CHOICE,10,INACTIVE,2025-12-24T07:27:10.639685+00:00,0.0
6cb1db0f-b577-4f9f-b4ba-ea3be73ab836,I remain productive in uncertain or ambiguous situations.,SINGLE_CHOICE,10,INACTIVE,2025-12-24T07:27:10.639647+00:00,0.0
52c720ad-4b3c-4b70-836d-f4c7c7e6f80c,I can learn from my mistakes and adjust my approach accordingly.,SINGLE_CHOICE,10,INACTIVE,2025-12-24T07:27:10.639608+00:00,0.0
770f841e-edd3-42dc-89ef-e2a0b7081343,I embrace new methodologies and approaches to work.,SINGLE_CHOICE,10,INACTIVE,2025-12-24T07:27:10.639569+00:00,0.0
13c068a4-d474-4f76-8722-c7f098fcfd6a,I can work effectively even when requirements change frequently.,SINGLE_CHOICE,10,INACTIVE,2025-12-24T07:27:10.639530+00:00,0.0
d5cf675b-f6cd-4817-a681-32fea6697bfc,I adapt quickly to new tools and technologies.,SINGLE_CHOICE,10,INACTIVE,2025-12-24T07:27:10.639485+00:00,0.0
d1d6fcf8-2a1b-48da-a670-158344c1aa72,I understand how small details can impact overall system performance.,SINGLE_CHOICE,10,INACTIVE,2025-12-24T07:27:10.639405+00:00,0.0
3582a51a-1217-4e86-87ce-585be668612a,I enjoy work that requires precision and accuracy.,SINGLE_CHOICE,10,INACTIVE,2025-12-24T07:27:10.639341+00:00,0.0
ee707e4c-4417-4ebb-a8d9-02e7db538a96,I can maintain focus on detailed tasks for extended periods.,SINGLE_CHOICE,10,INACTIVE,2025-12-24T07:27:10.639275+00:00,0.0
5b3ab02d-434d-4092-a182-5900427a11a4,I notice when something doesn't look or work quite right.,SINGLE_CHOICE,10,INACTIVE,2025-12-24T07:27:10.639230+00:00,0.0
e3bd0fbc-9e24-4e6a-81f2-e007b89bfe4b,I am meticulous when working with data or code.,SINGLE_CHOICE,10,INACTIVE,2025-12-24T07:27:10.639191+00:00,0.0
9d37524f-9d9d-4411-92e4-9ba41735d9a1,I can spot patterns in complex information.,SINGLE_CHOICE,10,INACTIVE,2025-12-24T07:27:10.639153+00:00,0.0
5f8e5de8-12c9-4808-8f05-b08ba38940b1,I maintain organized notes and documentation.,SINGLE_CHOICE,10,INACTIVE,2025-12-24T07:27:10.639113+00:00,0.0
2a060c03-5e80-43eb-b7ba-389c1a992f19,I follow established protocols and procedures carefully.,SINGLE_CHOICE,10,INACTIVE,2025-12-24T07:27:10.639073+00:00,0.0
af893e44-38b8-489d-930c-16a3c656c5b9,I double-check my work before considering it complete.,SINGLE_CHOICE,10,INACTIVE,2025-12-24T07:27:10.639021+00:00,0.0
bbde773f-973f-47b7-8a27-e2e744e84707,I naturally notice small errors or inconsistencies.,SINGLE_CHOICE,10,INACTIVE,2025-12-24T07:27:10.638983+00:00,0.0
41820b88-7e52-407a-92e4-223aaa2e7f56,I believe innovation often comes from combining existing ideas in new ways.,SINGLE_CHOICE,10,INACTIVE,2025-12-24T07:27:10.638945+00:00,0.0
ed587e6f-3a03-4247-8945-cab70b1a659f,I enjoy learning about new technologies and their potential applications.,SINGLE_CHOICE,10,INACTIVE,2025-12-24T07:27:10.638907+00:00,0.0
3153835c-7d30-460d-9527-6fff72d5a755,I can accept when my creative solutions don't work and pivot accordingly.,SINGLE_CHOICE,10,INACTIVE,2025-12-24T07:27:10.638868+00:00,0.0
45b8f86b-a60c-4d5b-b33c-f63e3eba51a1,I enjoy prototyping and testing new ideas.,SINGLE_CHOICE,10,INACTIVE,2025-12-24T07:27:10.638829+00:00,0.0
d6404707-5d54-437e-99d0-fe7fb802a8b1,I draw inspiration from various fields and disciplines.,SINGLE_CHOICE,10,INACTIVE,2025-12-24T07:27:10.638790+00:00,0.0
77c727c7-7ce8-4fe8-a9b0-6277131f7ec6,I can balance creative thinking with practical constraints.,SINGLE_CHOICE,10,INACTIVE,2025-12-24T07:27:10.638751+00:00,0.0
2dec69d2-7138-4c87-a65b-12285ebac1d9,I enjoy optimizing and improving existing processes.,SINGLE_CHOICE,10,INACTIVE,2025-12-24T07:27:10.638712+00:00,0.0
7045c370-b36b-425e-a192-d4d37e564870,I am not afraid to suggest unconventional ideas.,SINGLE_CHOICE,10,INACTIVE,2025-12-24T07:27:10.638672+00:00,0.0
36ed0f51-c7d3-4d02-8caa-7374595bba44,I can approach problems from multiple angles.,SINGLE_CHOICE,10,INACTIVE,2025-12-24T07:27:10.638633+00:00,0.0
b4587702-a168-4d5f-9e6d-9b24fb45ee55,I enjoy thinking of novel solutions to problems.,SINGLE_CHOICE,10,INACTIVE,2025-12-24T07:27:10.638591+00:00,0.0
7181018d-87b6-46b8-b9e8-d753dfa6db58,I value different perspectives and approaches to problem-solving.,SINGLE_CHOICE,10,INACTIVE,2025-12-24T07:27:10.638533+00:00,0.0
605e4bce-d57f-475f-8450-d4cb35165b73,I follow through on commitments I make to my team.,SINGLE_CHOICE,10,INACTIVE,2025-12-24T07:27:10.638493+00:00,0.0
88cc077a-82bd-4d41-a200-d294b7211607,I can lead a team when necessary.,SINGLE_CHOICE,10,INACTIVE,2025-12-24T07:27:10.638452+00:00,0.0
6a799985-5c74-4fe0-84a1-b743eba578df,I respect deadlines and understand how my work affects the team.,SINGLE_CHOICE,10,INACTIVE,2025-12-24T07:27:10.638408+00:00,0.0
8018b202-de60-4c07-b6cf-a67e1d7dd42e,I communicate proactively about my progress and challenges.,SINGLE_CHOICE,10,INACTIVE,2025-12-24T07:27:10.638321+00:00,0.0
0563c27f-1b10-4654-b879-a6e999d51277,I can work effectively with people from diverse backgrounds.,SINGLE_CHOICE,10,INACTIVE,2025-12-24T07:27:10.627542+00:00,0.0
00cfc406-40ca-4035-a2dd-afa8ae83b2f8,I help other team members when they are struggling.,SINGLE_CHOICE,10,INACTIVE,2025-12-24T07:27:10.627502+00:00,0.0
c2c7c1bd-73ed-45d8-b44b-0e5c082a4638,I take responsibility for my assigned tasks in group projects.,SINGLE_CHOICE,10,INACTIVE,2025-12-24T07:27:10.627463+00:00,0.0
62e0b81f-4a6a-4ab3-98a9-195ffb64ee1d,I can compromise when team members have different opinions.,SINGLE_CHOICE,10,INACTIVE,2025-12-24T07:27:10.627423+00:00,0.0
f04c31b9-4ae1-437a-b349-f1c5332e5e46,I enjoy working in team environments.,SINGLE_CHOICE,10,INACTIVE,2025-12-24T07:27:10.627384+00:00,0.0
32a42c3a-757c-4e36-b92f-e0a1ef16fa79,I adjust my communication style based on my audience.,SINGLE_CHOICE,10,INACTIVE,2025-12-24T07:27:10.627342+00:00,0.0
82e5f923-f242-4e2a-a364-34650e2bdf6f,I can communicate effectively in online platforms and forums.,SINGLE_CHOICE,10,INACTIVE,2025-12-24T07:27:10.627283+00:00,0.0
554df232-d6f8-45cb-ad5f-88f6284df75d,I feel comfortable presenting my ideas to small groups.,SINGLE_CHOICE,10,INACTIVE,2025-12-24T07:27:10.626905+00:00,0.0
655f7189-5c89-4235-8cd2-26ad50ba5aa5,I can document my work and processes clearly.,SINGLE_CHOICE,10,INACTIVE,2025-12-24T07:27:10.626868+00:00,0.0
bd34c0a3-81fd-4cae-bdba-9741d72c95df,I actively listen to others during conversations.,SINGLE_CHOICE,10,INACTIVE,2025-12-24T07:27:10.626829+00:00,0.0
5badd7af-f652-49d7-b25a-22df2a8faa6a,I can explain technical problems clearly when seeking help.,SINGLE_CHOICE,10,INACTIVE,2025-12-24T07:27:10.626790+00:00,0.0
253a77ee-32cc-44c9-b959-2b395671ae89,I am open to receiving feedback about my work.,SINGLE_CHOICE,10,INACTIVE,2025-12-24T07:27:10.626751+00:00,0.0
015b3eb9-00c5-4d84-9e86-9ecd309d8dce,I can give constructive feedback to peers.,SINGLE_CHOICE,10,INACTIVE,2025-12-24T07:27:10.626712+00:00,0.0
018b5ee2-7000-45d0-88bf-d7496b49dc5a,I feel comfortable participating in group discussions and meetings.,SINGLE_CHOICE,10,INACTIVE,2025-12-24T07:27:10.626673+00:00,0.0
b83e1287-b019-4d49-bd86-db41b664f27d,I can clearly articulate my thoughts and ideas in writing.,SINGLE_CHOICE,10,INACTIVE,2025-12-24T07:27:10.626634+00:00,0.0
ad93e380-40ef-476c-ac7c-0b50bc306bd4,"I maintain perspective on challenges, understanding they are temporary.",SINGLE_CHOICE,10,INACTIVE,2025-12-24T07:27:10.626595+00:00,0.0
6aa4a432-4288-4499-9403-89a7247ecc5c,I seek support when feeling overwhelmed by academic pressure.,SINGLE_CHOICE,10,INACTIVE,2025-12-24T07:27:10.626537+00:00,0.0
6b1d7bd9-b4ae-4261-9683-f67344025c4a,I can adapt to changing requirements and priorities.,SINGLE_CHOICE,10,INACTIVE,2025-12-24T07:27:10.626499+00:00,0.0
2e529454-a061-4306-93ad-6ca0abc57830,I balance my study/work time with personal life and hobbies.,SINGLE_CHOICE,10,INACTIVE,2025-12-24T07:27:10.626459+00:00,0.0
f9ee2ece-7f60-43d0-90c9-dd5315c42a79,I have techniques to stay calm when facing tight deadlines.,SINGLE_CHOICE,10,INACTIVE,2025-12-24T07:27:10.626421+00:00,0.0
9076fd1d-66c4-46a4-927e-d259f5480da3,I can recognize when I need to step away from a problem and return with fresh perspective.,SINGLE_CHOICE,10,INACTIVE,2025-12-24T07:27:10.626382+00:00,0.0
b92dcb5a-6b92-46a9-99d4-b6144dc1d9fc,"I practice healthy habits (exercise, nutrition, sleep) to support my learning.",SINGLE_CHOICE,10,INACTIVE,2025-12-24T07:27:10.626344+00:00,0.0
4a4ba874-4fe1-4362-81a7-476b1c7e20dd,I take regular breaks to avoid burnout during intensive work.,SINGLE_CHOICE,10,INACTIVE,2025-12-24T07:27:10.626305+00:00,0.0
06509ff0-263b-41df-a3cb-d360ef983fc7,I can maintain a positive attitude when facing difficult challenges.,SINGLE_CHOICE,10,INACTIVE,2025-12-24T07:27:10.626266+00:00,0.0
c63f671d-747b-4b9e-a307-940a70a74a73,I have effective strategies for managing stress during challenging tasks.,SINGLE_CHOICE,10,INACTIVE,2025-12-24T07:27:10.626227+00:00,0.0
eb49af3a-9e3a-42e4-b374-27099381f4dd,I am open to relocating for job opportunities if necessary.,SINGLE_CHOICE,10,INACTIVE,2025-12-24T07:27:10.626187+00:00,0.0
52161361-2ab0-4390-a21d-145edb40806d,I understand the value of building a portfolio of projects.,SINGLE_CHOICE,10,INACTIVE,2025-12-24T07:27:10.626148+00:00,0.0
fc7da659-83d8-4335-8531-3a6a0e9ad958,I am prepared to work on my interview and resume skills.,SINGLE_CHOICE,10,INACTIVE,2025-12-24T07:27:10.626109+00:00,0.0
f64f690b-a7aa-4004-8707-6dbe21891fec,I have realistic salary expectations for entry-level positions in this field.,SINGLE_CHOICE,10,INACTIVE,2025-12-24T07:27:10.626070+00:00,0.0
3afeb675-50f6-4014-8093-eb8af5a4eb43,I am willing to start in entry-level positions to gain experience.,SINGLE_CHOICE,10,INACTIVE,2025-12-24T07:27:10.626031+00:00,0.0
608205f2-77a7-4e3e-8fa4-4bb8ab503873,I understand the importance of building a professional network.,SINGLE_CHOICE,10,INACTIVE,2025-12-24T07:27:10.625991+00:00,0.0
fde3c209-5456-4a57-9ded-c8fb7c878c66,"I have considered the work environment I prefer (remote, office, hybrid).",SINGLE_CHOICE,10,INACTIVE,2025-12-24T07:27:10.625937+00:00,0.0
14e57310-72d9-4b8f-ba5d-5d5bea28b405,I am prepared to continue learning throughout my career.,SINGLE_CHOICE,10,INACTIVE,2025-12-24T07:27:10.625884+00:00,0.0
744c66cc-f312-44ce-b983-d5b6e24e7b70,I understand the typical career progression in this industry.,SINGLE_CHOICE,10,INACTIVE,2025-12-24T07:27:10.625845+00:00,0.0
f8f091c2-166b-495e-8082-1ab979299711,I have researched the job market for this technical field.,SINGLE_CHOICE,10,INACTIVE,2025-12-24T07:27:10.625806+00:00,0.0
4ea48d44-ff79-497c-b8ca-a4eb3cd51a10,I can explain technical concepts to non-technical people.,SINGLE_CHOICE,10,INACTIVE,2025-12-24T07:27:10.625767+00:00,0.0
e24a1f4a-f2a5-4e71-bdbf-644f414fd981,I understand the importance of data security and privacy.,SINGLE_CHOICE,10,INACTIVE,2025-12-24T07:27:10.625728+00:00,0.0
f4681333-6466-4f7f-96f2-cd91ebefa0d0,I feel confident using keyboard shortcuts to improve efficiency.,SINGLE_CHOICE,10,INACTIVE,2025-12-24T07:27:10.625690+00:00,0.0
dbd59f0c-bf76-4ee9-aa6e-958c0391dbde,I can quickly learn to use new digital tools and platforms.,SINGLE_CHOICE,10,INACTIVE,2025-12-24T07:27:10.625651+00:00,0.0
41e82cdb-4276-411c-a410-3c002dc625b1,I enjoy understanding how complex systems work.,SINGLE_CHOICE,10,INACTIVE,2025-12-24T07:27:10.625613+00:00,0.0
1bead4d7-640a-41de-acd4-87da1743b703,I stay updated with current technology trends.,SINGLE_CHOICE,10,INACTIVE,2025-12-24T07:27:10.625574+00:00,0.0
4bc4a871-1f9d-42cd-85ec-7a772dc91434,I can troubleshoot basic technical problems on my own.,SINGLE_CHOICE,10,INACTIVE,2025-12-24T07:27:10.625535+00:00,0.0
6f7862e2-3435-4af7-a615-f01d5a964bd2,I understand basic computer operations and file management.,SINGLE_CHOICE,10,INACTIVE,2025-12-24T07:27:10.625498+00:00,0.0
c28718c6-4d4e-44f7-9a08-6f36e4c5adaf,I feel comfortable learning new software applications.,SINGLE_CHOICE,10,INACTIVE,2025-12-24T07:27:10.625458+00:00,0.0
370a84c3-3498-46f2-a222-56b6ea04d1df,I enjoy working with technology and digital tools.,SINGLE_CHOICE,10,INACTIVE,2025-12-24T07:27:10.625418+00:00,0.0
8ea23b36-d757-46ce-bf02-2f4f4b5243de,I actively seek out additional practice beyond assigned coursework.,SINGLE_CHOICE,10,INACTIVE,2025-12-24T07:27:10.625378+00:00,0.0
546c8284-03b3-495c-8e7b-9096d4628ad2,I can adapt my learning style to different types of technical content.,SINGLE_CHOICE,10,INACTIVE,2025-12-24T07:27:10.625338+00:00,0.0
e4e7092a-25d2-44f5-a76e-17d413140e78,I set specific learning goals for each study session.,SINGLE_CHOICE,10,INACTIVE,2025-12-24T07:27:10.625296+00:00,0.0
5cf8a0f5-3889-4254-ada5-56879eebe507,"I use various learning resources (videos, books, articles) to understand difficult topics.",SINGLE_CHOICE,10,INACTIVE,2025-12-24T07:27:10.625252+00:00,0.0
05c6927f-c4bb-4f25-bd92-1bf7373eaf2a,I can maintain focus during long study sessions.,SINGLE_CHOICE,10,INACTIVE,2025-12-24T07:27:10.625158+00:00,0.0
14c1340a-c734-4166-b8aa-1dbe1dc57a19,I enjoy collaborating with others on learning projects.,SINGLE_CHOICE,10,INACTIVE,2025-12-24T07:27:10.608786+00:00,0.0
7bf2f763-3ee0-48db-8b14-756f66e8c450,I review previous lessons to reinforce my understanding.,SINGLE_CHOICE,10,INACTIVE,2025-12-24T07:27:10.608746+00:00,0.0
bab62527-94bc-4873-8f42-2ab3d1bd8684,I regularly take notes when learning new material.,SINGLE_CHOICE,10,INACTIVE,2025-12-24T07:27:10.608707+00:00,0.0
23b48750-0c5b-4125-82d4-4b524b512d6f,I learn best when I can immediately apply new concepts to practical problems.,SINGLE_CHOICE,10,INACTIVE,2025-12-24T07:27:10.608668+00:00,0.0
22cca430-2b23-4842-ac15-b409fbd6a39f,I prefer hands-on learning over theoretical instruction.,SINGLE_CHOICE,10,INACTIVE,2025-12-24T07:27:10.608629+00:00,0.0
e03f965e-4012-47e6-b514-03061a6dc699,I feel a sense of responsibility to my future peers and instructors to contribute positively to the learning environment.,SINGLE_CHOICE,10,INACTIVE,2025-12-24T07:27:10.608589+00:00,0.0
61b90a98-f207-4997-a066-7e6b8b1e04eb,"I am able to maintain a consistent sleep schedule, which I know is important for learning.",SINGLE_CHOICE,10,INACTIVE,2025-12-24T07:27:10.608550+00:00,0.0
eb811ff0-09aa-4a15-a774-b0332730980c,"If I face a personal crisis, I have a support system I can rely on.",SINGLE_CHOICE,10,INACTIVE,2025-12-24T07:27:10.608510+00:00,0.0
c1f3a982-f133-4e6b-8405-b882ae2e603d,I am in a good state of mental and physical health to take on a challenging program.,SINGLE_CHOICE,10,INACTIVE,2025-12-24T07:27:10.608471+00:00,0.0
0b9f2079-33cf-4a50-a489-ecd7331568c0,I am financially prepared for the duration of the program so that it does not become a major stressor.,SINGLE_CHOICE,10,INACTIVE,2025-12-24T07:27:10.608430+00:00,0.0
823c5fab-2255-4696-9093-09da049204c5,I have a quiet space where I can concentrate on my coursework.,SINGLE_CHOICE,10,INACTIVE,2025-12-24T07:27:10.608389+00:00,0.0
9405cdcb-6257-4d82-994d-5b790eb7e787,"I have minimal external commitments (e.g., a second job, major family duties) that would interfere with my studies.",SINGLE_CHOICE,10,INACTIVE,2025-12-24T07:27:10.608346+00:00,0.0
b4ca0a58-2be7-4e97-8a49-16e10c618641,My family or friends are supportive of me undertaking this program.,SINGLE_CHOICE,10,INACTIVE,2025-12-24T07:27:10.608228+00:00,0.0
b64823cf-5f17-4216-a248-68b99611010e,I believe there is usually a logical explanation for why something isn't working.,SINGLE_CHOICE,10,INACTIVE,2025-12-24T07:27:10.607833+00:00,0.0
bc64a6de-4202-4813-979b-ae44ecc0458c,I can hold multiple pieces of information in my mind while working through a task.,SINGLE_CHOICE,10,INACTIVE,2025-12-24T07:27:10.607782+00:00,0.0
9367a664-0ca4-4e93-b3cf-cf38a2ac025c,I enjoy finding more efficient ways to do things.,SINGLE_CHOICE,10,INACTIVE,2025-12-24T07:27:10.607724+00:00,0.0
9a1c4cdf-8840-4b84-b4e4-37a96794da7d,"When presented with a new problem, I start by defining it clearly.",SINGLE_CHOICE,10,INACTIVE,2025-12-24T07:27:10.607639+00:00,0.0
c1ccaf2f-afa9-41c0-a294-452af4e4dd65,I am comfortable working with abstract concepts.,SINGLE_CHOICE,10,INACTIVE,2025-12-24T07:27:10.607600+00:00,0.0
d2df4e4c-83a0-4648-8e30-06ffeb95b7b5,I think about cause and effect relationships frequently.,SINGLE_CHOICE,10,INACTIVE,2025-12-24T07:27:10.607560+00:00,0.0
42bd2e73-3027-4265-b6ea-1c3edf0cf7bd,I can easily follow a multi-step process or a set of instructions.,SINGLE_CHOICE,10,INACTIVE,2025-12-24T07:27:10.607520+00:00,0.0
0510a222-08bb-4656-a133-62b40cfbaba6,"I pay strong attention to small details, as I know they can be critical.",SINGLE_CHOICE,10,INACTIVE,2025-12-24T07:27:10.607470+00:00,0.0
71805ce8-33fd-4f5a-b618-b2419c5c8958,I am a systematic and organized thinker.,SINGLE_CHOICE,10,INACTIVE,2025-12-24T07:27:10.607414+00:00,0.0
