Id,Question,Question Type,Grade Point,Status,Created At,Average Performance
7e6fb66c-2b1c-49b5-8ea2-ce9872463e1f,I draw inspiration from various fields and disciplines.,SINGLE_CHOICE,1,INACTIVE,2025-12-24T07:01:42.747785+00:00,0.0
e2e188bf-16d2-46f4-8ef4-994914c59547,I can balance creative thinking with practical constraints.,SINGLE_CHOICE,1,INACTIVE,2025-12-24T07:01:42.747742+00:00,0.0
b1be6cab-4e63-44fb-b237-768e7c48fe30,I enjoy optimizing and improving existing processes.,SINGLE_CHOICE,1,INACTIVE,2025-12-24T07:01:42.747701+00:00,0.0
93a89104-7c27-482e-b23d-009dab918fb6,I am not afraid to suggest unconventional ideas.,SINGLE_CHOICE,1,INACTIVE,2025-12-24T07:01:42.747657+00:00,0.0
60b50c60-8b4d-4074-a2ae-bb5cd70d8314,I can approach problems from multiple angles.,SINGLE_CHOICE,1,INACTIVE,2025-12-24T07:01:42.747596+00:00,0.0
f309b26f-c174-4056-a517-44b068bdf95b,I enjoy thinking of novel solutions to problems.,SINGLE_CHOICE,1,INACTIVE,2025-12-24T07:01:42.747528+00:00,0.0
ba286925-0953-4b2c-ae0b-a9e72eb7efe7,I value different perspectives and approaches to problem-solving.,SINGLE_CHOICE,1,INACTIVE,2025-12-24T07:01:42.747484+00:00,0.0
6ecf448c-3f95-4378-ab0a-ad5bf6172787,I follow through on commitments I make to my team.,SINGLE_CHOICE,1,INACTIVE,2025-12-24T07:01:42.747442+00:00,0.0
edd41f27-8bdf-4ef9-8154-fcfa36ec1229,I can lead a team when necessary.,SINGLE_CHOICE,1,INACTIVE,2025-12-24T07:01:42.747399+00:00,0.0
6674f4a7-5def-40c0-a4e1-16f6fc0f6497,I respect deadlines and understand how my work affects the team.,SINGLE_CHOICE,1,INACTIVE,2025-12-24T07:01:42.747353+00:00,0.0
4c65612a-83ef-480f-9f11-45ffa8dffeda,I communicate proactively about my progress and challenges.,SINGLE_CHOICE,1,INACTIVE,2025-12-24T07:01:42.747255+00:00,0.0
df836da4-980c-4dbd-9efd-1c7769a90a1c,I can work effectively with people from diverse backgrounds.,SINGLE_CHOICE,1,INACTIVE,2025-12-24T07:01:42.733794+00:00,0.0
617822ca-f794-4a8d-aa66-0121306e663e,I help other team members when they are struggling.,SINGLE_CHOICE,1,INACTIVE,2025-12-24T07:01:42.733755+00:00,0.0
14770d9d-5a8e-48f6-a79d-9bab63f8cefc,I take responsibility for my assigned tasks in group projects.,SINGLE_CHOICE,1,INACTIVE,2025-12-24T07:01:42.733714+00:00,0.0
367d3cb4-5c33-46a4-a47f-a7e1a450003e,I can compromise when team members have different opinions.,SINGLE_CHOICE,1,INACTIVE,2025-12-24T07:01:42.733675+00:00,0.0
6a9cebcc-df9d-4977-b423-cfa876505fc6,I enjoy working in team environments.,SINGLE_CHOICE,1,INACTIVE,2025-12-24T07:01:42.733633+00:00,0.0
58d9332e-8802-4d62-b9b9-1f734f8d3ef6,I adjust my communication style based on my audience.,SINGLE_CHOICE,1,INACTIVE,2025-12-24T07:01:42.733590+00:00,0.0
bfc13d7d-4e71-4778-b043-dcc3a3497f69,I can communicate effectively in online platforms and forums.,SINGLE_CHOICE,1,INACTIVE,2025-12-24T07:01:42.733506+00:00,0.0
2190ff12-dd84-4369-83df-6f2ed1297e8a,I feel comfortable presenting my ideas to small groups.,SINGLE_CHOICE,1,INACTIVE,2025-12-24T07:01:42.732966+00:00,0.0
f813aeaf-b24c-47d6-bc98-95272e5d21a1,I can document my work and processes clearly.,SINGLE_CHOICE,1,INACTIVE,2025-12-24T07:01:42.732925+00:00,0.0
1be68e78-8d78-4192-ab1f-2dc3c00c1178,I actively listen to others during conversations.,SINGLE_CHOICE,1,INACTIVE,2025-12-24T07:01:42.732882+00:00,0.0
dbdf03b1-6b31-4a98-8542-00c3a3ac1a33,I can explain technical problems clearly when seeking help.,SINGLE_CHOICE,1,INACTIVE,2025-12-24T07:01:42.732826+00:00,0.0
7cf76d10-30cf-4937-92c8-4b95a121ea20,I am open to receiving feedback about my work.,SINGLE_CHOICE,1,INACTIVE,2025-12-24T07:01:42.732752+00:00,0.0
d81a06ca-a233-404c-9a0a-d72c8108d119,I can give constructive feedback to peers.,SINGLE_CHOICE,1,INACTIVE,2025-12-24T07:01:42.732691+00:00,0.0
2ce5b444-39fd-45e4-b5d1-53b0a72584d9,I feel comfortable participating in group discussions and meetings.,SINGLE_CHOICE,1,INACTIVE,2025-12-24T07:01:42.732631+00:00,0.0
360c64c2-6339-427b-949c-c971ba084328,I can clearly articulate my thoughts and ideas in writing.,SINGLE_CHOICE,1,INACTIVE,2025-12-24T07:01:42.732590+00:00,0.0
224394ef-99a3-4763-83b4-7ac6b026a935,"I maintain perspective on challenges, understanding they are temporary.",SINGLE_CHOICE,1,INACTIVE,2025-12-24T07:01:42.732550+00:00,0.0
9807cae7-3e61-45c9-9725-e196fd092dd6,I seek support when feeling overwhelmed by academic pressure.,SINGLE_CHOICE,1,INACTIVE,2025-12-24T07:01:42.732510+00:00,0.0
7e44a9b8-2327-4b72-84fd-e3d39f337c65,I can adapt to changing requirements and priorities.,SINGLE_CHOICE,1,INACTIVE,2025-12-24T07:01:42.732470+00:00,0.0
9bce8d56-5f02-4bde-a1e5-b477173e3624,I balance my study/work time with personal life and hobbies.,SINGLE_CHOICE,1,INACTIVE,2025-12-24T07:01:42.732431+00:00,0.0
7d9a6183-f6a4-4bad-92b8-bc9a80d24420,I have techniques to stay calm when facing tight deadlines.,SINGLE_CHOICE,1,INACTIVE,2025-12-24T07:01:42.732392+00:00,0.0
6a21c8b0-4568-4645-8f2b-c5388d3d3747,I can recognize when I need to step away from a problem and return with fresh perspective.,SINGLE_CHOICE,1,INACTIVE,2025-12-24T07:01:42.732352+00:00,0.0
84d18598-00ff-4376-8eec-52aa3c142519,"I practice healthy habits (exercise, nutrition, sleep) to support my learning.",SINGLE_CHOICE,1,INACTIVE,2025-12-24T07:01:42.732313+00:00,0.0
347aa78e-b03f-4a08-8380-7adf1d89c878,I take regular breaks to avoid burnout during intensive work.,SINGLE_CHOICE,1,INACTIVE,2025-12-24T07:01:42.732272+00:00,0.0
9b964007-e1b9-40b7-a423-7485e2b428cc,I can maintain a positive attitude when facing difficult challenges.,SINGLE_CHOICE,1,INACTIVE,2025-12-24T07:01:42.732218+00:00,0.0
d29ca9fa-326e-41ff-b922-71329ef3ccb1,I have effective strategies for managing stress during challenging tasks.,SINGLE_CHOICE,1,INACTIVE,2025-12-24T07:01:42.732179+00:00,0.0
09615dcc-2a4d-4998-97f0-3a0bd70e8193,I am open to relocating for job opportunities if necessary.,SINGLE_CHOICE,1,INACTIVE,2025-12-24T07:01:42.732139+00:00,0.0
3848fece-feed-42d9-afaf-e4e7d5930446,I understand the value of building a portfolio of projects.,SINGLE_CHOICE,1,INACTIVE,2025-12-24T07:01:42.732100+00:00,0.0
5948456a-c8b0-4e3d-9d5a-0abf168dd004,I am prepared to work on my interview and resume skills.,SINGLE_CHOICE,1,INACTIVE,2025-12-24T07:01:42.732061+00:00,0.0
0b64bfaf-13c5-4d03-a65d-9c295fa457ba,I have realistic salary expectations for entry-level positions in this field.,SINGLE_CHOICE,1,INACTIVE,2025-12-24T07:01:42.732022+00:00,0.0
3556fb17-eb3c-43d0-8993-b92395d114eb,I am willing to start in entry-level positions to gain experience.,SINGLE_CHOICE,1,INACTIVE,2025-12-24T07:01:42.731983+00:00,0.0
6c7fe3cf-b0ff-4f66-ae7f-f6215e4b3a30,I understand the importance of building a professional network.,SINGLE_CHOICE,1,INACTIVE,2025-12-24T07:01:42.731943+00:00,0.0
b9af39e2-06c9-4eb5-9572-6fc9a736dbf2,"I have considered the work environment I prefer (remote, office, hybrid).",SINGLE_CHOICE,1,INACTIVE,2025-12-24T07:01:42.731904+00:00,0.0
71d6e1ce-97d3-425c-b559-81e2a7e82658,I am prepared to continue learning throughout my career.,SINGLE_CHOICE,1,INACTIVE,2025-12-24T07:01:42.731865+00:00,0.0
2f83f050-22eb-4b36-9450-024bed89b49b,I understand the typical career progression in this industry.,SINGLE_CHOICE,1,INACTIVE,2025-12-24T07:01:42.731826+00:00,0.0
5072a33f-2d86-4424-8d88-72841d5c6bd5,I have researched the job market for this technical field.,SINGLE_CHOICE,1,INACTIVE,2025-12-24T07:01:42.731786+00:00,0.0
4e9976dd-5bbd-45a7-bf06-a2b3bc65f3d2,I can explain technical concepts to non-technical people.,SINGLE_CHOICE,1,INACTIVE,2025-12-24T07:01:42.731746+00:00,0.0
8cdaf37a-1583-4d44-9117-61b21f27f759,I understand the importance of data security and privacy.,SINGLE_CHOICE,1,INACTIVE,2025-12-24T07:01:42.731707+00:00,0.0
80bc8d91-e329-48a1-afba-1b0d2ca139f9,I feel confident using keyboard shortcuts to improve efficiency.,SINGLE_CHOICE,1,INACTIVE,2025-12-24T07:01:42.731667+00:00,0.0
76e1944a-fca2-4163-8066-523cfae4b306,I can quickly learn to use new digital tools and platforms.,SINGLE_CHOICE,1,INACTIVE,2025-12-24T07:01:42.731627+00:00,0.0
52a75842-42e0-4d85-9b09-665800cd7f31,I enjoy understanding how complex systems work.,SINGLE_CHOICE,1,INACTIVE,2025-12-24T07:01:42.731587+00:00,0.0
b7990605-a5b2-465c-8ad9-40728109e520,I stay updated with current technology trends.,SINGLE_CHOICE,1,INACTIVE,2025-12-24T07:01:42.731546+00:00,0.0
6e2a39d7-e343-4e50-9863-2f7b7373a9fb,I can troubleshoot basic technical problems on my own.,SINGLE_CHOICE,1,INACTIVE,2025-12-24T07:01:42.731505+00:00,0.0
6c775ab4-1ef1-4122-a5ea-ea01eecf687b,I understand basic computer operations and file management.,SINGLE_CHOICE,1,INACTIVE,2025-12-24T07:01:42.731465+00:00,0.0
55f00a22-c10b-4a02-bdf0-db49a0b1f301,I feel comfortable learning new software applications.,SINGLE_CHOICE,1,INACTIVE,2025-12-24T07:01:42.731424+00:00,0.0
3f3599ea-5588-4425-8ab1-1a88a37926a2,I enjoy working with technology and digital tools.,SINGLE_CHOICE,1,INACTIVE,2025-12-24T07:01:42.731383+00:00,0.0
6419decc-bb86-46f4-9b08-aa8fb314c69f,I actively seek out additional practice beyond assigned coursework.,SINGLE_CHOICE,1,INACTIVE,2025-12-24T07:01:42.731342+00:00,0.0
b9b9fbc4-a864-49a9-89e6-1d263bf0ace6,I can adapt my learning style to different types of technical content.,SINGLE_CHOICE,1,INACTIVE,2025-12-24T07:01:42.731300+00:00,0.0
cb8ff871-657b-449a-8483-228938b69672,I set specific learning goals for each study session.,SINGLE_CHOICE,1,INACTIVE,2025-12-24T07:01:42.731258+00:00,0.0
ba6c9e0d-d4fb-4990-978c-44c55cb1ef4e,"I use various learning resources (videos, books, articles) to understand difficult topics.",SINGLE_CHOICE,1,INACTIVE,2025-12-24T07:01:42.731213+00:00,0.0
360454c9-b010-45f1-86d6-aa7e7a0267ea,I can maintain focus during long study sessions.,SINGLE_CHOICE,1,INACTIVE,2025-12-24T07:01:42.731114+00:00,0.0
c3fd2a33-ce7e-4107-987c-488636ebbb70,I enjoy collaborating with others on learning projects.,SINGLE_CHOICE,1,INACTIVE,2025-12-24T07:01:42.714860+00:00,0.0
aa4a49af-963c-42d2-91b6-21c91b6d2a08,I review previous lessons to reinforce my understanding.,SINGLE_CHOICE,1,INACTIVE,2025-12-24T07:01:42.714812+00:00,0.0
7fb680f9-302f-4f67-b5a2-a53dee7c164d,I regularly take notes when learning new material.,SINGLE_CHOICE,1,INACTIVE,2025-12-24T07:01:42.714772+00:00,0.0
2a4f5e6a-a1df-4c76-b5db-5a8b9f454dfc,I learn best when I can immediately apply new concepts to practical problems.,SINGLE_CHOICE,1,INACTIVE,2025-12-24T07:01:42.714731+00:00,0.0
e3c201dd-396d-4ad3-adff-89a4a58caa4a,I prefer hands-on learning over theoretical instruction.,SINGLE_CHOICE,1,INACTIVE,2025-12-24T07:01:42.714690+00:00,0.0
ab0738ea-5daf-40a9-9c3b-45643edd8533,I feel a sense of responsibility to my future peers and instructors to contribute positively to the learning environment.,SINGLE_CHOICE,1,INACTIVE,2025-12-24T07:01:42.714645+00:00,0.0
fba3f68d-bd26-4515-8e0e-a50676e25e09,"I am able to maintain a consistent sleep schedule, which I know is important for learning.",SINGLE_CHOICE,1,INACTIVE,2025-12-24T07:01:42.714532+00:00,0.0
64e1e413-186a-47f7-a9f7-52bc4667a5d8,"If I face a personal crisis, I have a support system I can rely on.",SINGLE_CHOICE,1,INACTIVE,2025-12-24T07:01:42.714492+00:00,0.0
baee877b-438a-48e1-9861-1fcba449fac1,I am in a good state of mental and physical health to take on a challenging program.,SINGLE_CHOICE,1,INACTIVE,2025-12-24T07:01:42.714452+00:00,0.0
9dabd298-3b7f-4d17-8339-9cdf1f77499f,I am financially prepared for the duration of the program so that it does not become a major stressor.,SINGLE_CHOICE,1,INACTIVE,2025-12-24T07:01:42.714412+00:00,0.0
c2bdee19-6d99-420b-9980-5a726d152d7c,I have a quiet space where I can concentrate on my coursework.,SINGLE_CHOICE,1,INACTIVE,2025-12-24T07:01:42.714371+00:00,0.0
1604f2d5-c1d5-403f-a0d2-cfca03fef88a,"I have minimal external commitments (e.g., a second job, major family duties) that would interfere with my studies.",SINGLE_CHOICE,1,INACTIVE,2025-12-24T07:01:42.714330+00:00,0.0
6770f8ad-0bd2-40a3-b64d-f83731401909,My family or friends are supportive of me undertaking this program.,SINGLE_CHOICE,1,INACTIVE,2025-12-24T07:01:42.714286+00:00,0.0
a74dad27-d7b3-4069-a7f7-04644fd44b23,I believe there is usually a logical explanation for why something isn't working.,SINGLE_CHOICE,1,INACTIVE,2025-12-24T07:01:42.714247+00:00,0.0
40a28d64-48f7-4857-8e45-6ab11f00795e,I can hold multiple pieces of information in my mind while working through a task.,SINGLE_CHOICE,1,INACTIVE,2025-12-24T07:01:42.714207+00:00,0.0
696c4cae-dfcc-4d7d-a475-39237cb638ee,I enjoy finding more efficient ways to do things.,SINGLE_CHOICE,1,INACTIVE,2025-12-24T07:01:42.714166+00:00,0.0
e7b57159-1e73-4127-84f3-3518ba3c42d9,"When presented with a new problem, I start by defining it clearly.",SINGLE_CHOICE,1,INACTIVE,2025-12-24T07:01:42.714127+00:00,0.0
f8bf1bc4-c13b-41ea-b141-4889597d292e,I am comfortable working with abstract concepts.,SINGLE_CHOICE,1,INACTIVE,2025-12-24T07:01:42.714088+00:00,0.0
8ebb086e-3d05-479b-b508-64e58fcc9b53,I think about cause and effect relationships frequently.,SINGLE_CHOICE,1,INACTIVE,2025-12-24T07:01:42.714047+00:00,0.0
723f6d20-63f6-4eb1-bce8-51fbb74b1275,I can easily follow a multi-step process or a set of instructions.,SINGLE_CHOICE,1,INACTIVE,2025-12-24T07:01:42.714006+00:00,0.0
11b0e87e-0ec2-4264-82fa-588ee1fd1c62,"I pay strong attention to small details, as I know they can be critical.",SINGLE_CHOICE,1,INACTIVE,2025-12-24T07:01:42.713965+00:00,0.0
58a5d171-25c2-43c8-bfe6-4f5baaf8f23a,I am a systematic and organized thinker.,SINGLE_CHOICE,1,INACTIVE,2025-12-24T07:01:42.713926+00:00,0.0
9f2a67d4-64fd-425e-b643-98db1896d555,I am good at managing my time to meet deadlines for learning modules and projects.,SINGLE_CHOICE,1,INACTIVE,2025-12-24T07:01:42.713885+00:00,0.0
93fb7736-d170-4d77-ac5e-ec135196eb07,I have a specific time and place where I can focus on my studies without distractions.,SINGLE_CHOICE,1,INACTIVE,2025-12-24T07:01:42.713845+00:00,0.0
411a7ae2-2294-4520-8230-233e6a79ef88,"I believe that with enough time and effort, I can understand almost any technical concept taught in this program.",SINGLE_CHOICE,1,INACTIVE,2025-12-24T07:01:42.713805+00:00,0.0
7a843985-2772-4706-8806-bfff5362e3fd,I regularly reflect on what I've learned to solidify my understanding.,SINGLE_CHOICE,1,INACTIVE,2025-12-24T07:01:42.713764+00:00,0.0
8ca6f0ac-2c4f-4dd4-af08-7d922327f6d6,I am comfortable asking for help from instructors or peers when I am truly stuck.,SINGLE_CHOICE,1,INACTIVE,2025-12-24T07:01:42.713723+00:00,0.0
543286ce-b02d-412b-afe5-f7f781436e48,I enjoy the process of figuring things out on my own.,SINGLE_CHOICE,1,INACTIVE,2025-12-24T07:01:42.713679+00:00,0.0
623f1353-39ec-4e88-a649-f4462ff8cf03,"I am good at breaking down large, complex problems into smaller, manageable steps.",SINGLE_CHOICE,1,INACTIVE,2025-12-24T07:01:42.713630+00:00,0.0
9f377d80-1f17-429c-9933-22bdf82fc2a8,I am proactive about my learning and don't wait to be told what to do next.,SINGLE_CHOICE,1,INACTIVE,2025-12-24T07:01:42.713290+00:00,0.0
cf5b2a84-1190-4627-8e04-823a4f82f722,"When I don't understand something, I know how to find answers online or in documentation.",SINGLE_CHOICE,1,INACTIVE,2025-12-24T07:01:42.713249+00:00,0.0
fd94e2b4-7fb4-4b04-9bdb-8724d85ca7d1,"I understand that debugging and problem-solving are central to software development, and I am prepared for it.",SINGLE_CHOICE,1,INACTIVE,2025-12-24T07:01:42.713207+00:00,0.0
e3b83eac-dc52-4301-887e-12ff9a93fe09,I have successfully overcome significant obstacles in my past to achieve a goal.,SINGLE_CHOICE,1,INACTIVE,2025-12-24T07:01:42.713166+00:00,0.0
7ccd32fa-a8c3-473d-9bd8-8d7ecd292932,"I view difficult feedback as an opportunity to improve, not as a personal criticism.",SINGLE_CHOICE,1,INACTIVE,2025-12-24T07:01:42.713124+00:00,0.0
47cefd09-41c9-42e8-a021-3b0e923490bf,"When I feel like giving up, I can push through those feelings.",SINGLE_CHOICE,1,INACTIVE,2025-12-24T07:01:42.713083+00:00,0.0
80f7fe3f-2a98-4159-aabd-a5b5fd2d0100,I am patient when learning new things and don't expect to become an expert immediately.,SINGLE_CHOICE,1,INACTIVE,2025-12-24T07:01:42.713041+00:00,0.0
da2bd989-2e9b-43e7-bab6-7a6d6536d800,I believe that my ability to solve complex problems can be developed with effort.,SINGLE_CHOICE,1,INACTIVE,2025-12-24T07:01:42.713000+00:00,0.0
6445295f-bc3c-45f9-8325-f94361145e61,I am comfortable with the idea of being 'stuck' on a problem for hours or even days.,SINGLE_CHOICE,1,INACTIVE,2025-12-24T07:01:42.712939+00:00,0.0
e7512452-9cfa-4b37-a119-ef1ff0dfae20,Setbacks don't discourage me for long; they make me more determined.,SINGLE_CHOICE,1,INACTIVE,2025-12-24T07:01:42.712728+00:00,0.0
a46cf86f-6b24-4871-a460-c30ffe79b434,"I consistently finish what I start, even when it becomes difficult or tedious.",SINGLE_CHOICE,1,INACTIVE,2025-12-24T07:01:42.712561+00:00,0.0
6eeefb1a-c3c1-43b1-bc07-153a166e6224,I am confident that the skills I learn will be valuable in the future job market.,SINGLE_CHOICE,1,INACTIVE,2025-12-24T07:01:42.712408+00:00,0.0
d810f2bf-83e5-438b-bc53-87751a0d4378,I see this program as a critical step in changing my life for the better.,SINGLE_CHOICE,1,INACTIVE,2025-12-24T07:01:42.712299+00:00,0.0
6e79487f-77ad-4df9-b08f-793a778b2428,The long-term benefits of this program outweigh the short-term costs of time and effort.,SINGLE_CHOICE,1,INACTIVE,2025-12-24T07:01:42.712242+00:00,0.0
d2f8c5ef-c0e1-46e3-8fa1-9825c08ef428,"I have researched what a career in this field is actually like, and I still want to pursue it.",SINGLE_CHOICE,1,INACTIVE,2025-12-24T07:01:42.712199+00:00,0.0
291504c2-329f-486e-b803-1777832f88ae,I am motivated more by the challenge of learning difficult concepts than by the fear of failure.,SINGLE_CHOICE,1,INACTIVE,2025-12-24T07:01:42.712157+00:00,0.0
4e8e59e8-eb56-4e33-9909-a71b9e77d760,I believe that completing this program is essential for my professional growth.,SINGLE_CHOICE,1,INACTIVE,2025-12-24T07:01:42.712115+00:00,0.0
0305fdc6-b679-4bfa-92bf-c609ed3b40df,I am willing to sacrifice some leisure time to dedicate to this program.,SINGLE_CHOICE,1,INACTIVE,2025-12-24T07:01:42.712072+00:00,0.0
2fec45df-369d-4fbc-8c7b-2b07c019ac19,The prospect of building something with code is exciting to me.,SINGLE_CHOICE,1,INACTIVE,2025-12-24T07:01:42.712029+00:00,0.0
7937bc03-341d-4e75-8265-52044642161d,I have set aside dedicated hours each week that are protected for this program.,SINGLE_CHOICE,1,INACTIVE,2025-12-24T07:01:42.711976+00:00,0.0
5e9d0eca-321e-48f0-85c1-5f3726970d05,I have a reliable computer and internet connection suitable for software development.,SINGLE_CHOICE,1,INACTIVE,2025-12-24T07:01:42.711835+00:00,0.0
826e8f84-ec04-47a0-8fda-e2746c415f89,"I enjoy puzzles, brain teasers, and logical games.",SINGLE_CHOICE,1,INACTIVE,2025-12-15T08:12:11.215535+00:00,0.0
6dfdf3c8-aa7b-4cf3-9edd-6bdaf90fe8d3,"I am confident in my ability to learn complex, technical subjects.",SINGLE_CHOICE,1,INACTIVE,2025-12-15T08:12:11.215496+00:00,0.0
eb42251a-3af8-4128-93fe-45ee81e3bd46,"When I fail at a complex task, my first instinct is to analyze my mistake and try again.",SINGLE_CHOICE,1,INACTIVE,2025-12-15T08:12:11.215457+00:00,0.0
a710b77c-0c6d-4341-9afa-e5e6f170aadb,"My primary motivation for joining this program comes from my own interest, not from pressure from others.",SINGLE_CHOICE,1,INACTIVE,2025-12-15T08:12:11.215418+00:00,0.0
3aae8f57-3fea-4a37-bc5e-8c0baa437dd1,"I have a clear, specific career goal that this program will help me achieve.",SINGLE_CHOICE,1,INACTIVE,2025-12-15T08:12:11.215378+00:00,0.0
010f41b6-0ff3-4721-9fa5-99e88583026c,I maintain consistent working hours to establish routine.,SINGLE_CHOICE,1,INACTIVE,2025-12-15T08:12:11.215339+00:00,0.0
9ac65050-61dc-4043-8ea8-ec83926dec79,I build buffer time into my schedules for unexpected delays.,SINGLE_CHOICE,1,INACTIVE,2025-12-15T08:12:11.215295+00:00,0.0
05d00f74-5708-4698-979a-d8f1cf2ae841,I can estimate realistic timeframes for completing work.,SINGLE_CHOICE,1,INACTIVE,2025-12-15T08:12:11.215233+00:00,0.0
775c776d-6301-4517-8bfa-87f04f915406,I balance urgent tasks with important long-term goals.,SINGLE_CHOICE,1,INACTIVE,2025-12-15T08:12:11.215166+00:00,0.0
d03dec0b-156e-4724-8126-fa8b21fd79e1,I regularly review how I spend my time to identify improvements.,SINGLE_CHOICE,1,INACTIVE,2025-12-15T08:12:11.215100+00:00,0.0
c8d0e80c-4c36-4f45-84e0-12e4ab1fd548,I set specific time limits for tasks to maintain productivity.,SINGLE_CHOICE,1,INACTIVE,2025-12-15T08:12:11.215036+00:00,0.0
6d02b4cb-65b4-48d7-8bfd-0f12b9d24554,I minimize distractions during focused work periods.,SINGLE_CHOICE,1,INACTIVE,2025-12-15T08:12:11.214970+00:00,0.0
7d9a9a8f-170c-4d6a-9354-d9dd1d5a8cac,I allocate time based on task priority.,SINGLE_CHOICE,1,INACTIVE,2025-12-15T08:12:11.214905+00:00,0.0
379bc3d0-db75-4e0c-abfa-b23d6b8a82fa,I avoid procrastination on important tasks.,SINGLE_CHOICE,1,INACTIVE,2025-12-15T08:12:11.214839+00:00,0.0
b6c860a0-eb76-48f2-9ec3-5066de68ec9d,I use calendars or planners to organize my schedule.,SINGLE_CHOICE,1,INACTIVE,2025-12-15T08:12:11.214774+00:00,0.0
7863772d-4297-4407-96f3-fd96b8fd6889,I revise my thinking when presented with new evidence.,SINGLE_CHOICE,1,INACTIVE,2025-12-15T08:12:11.214711+00:00,0.0
c7af65ec-4ae5-442b-b373-896728ea076e,I approach complex issues with curiosity and skepticism.,SINGLE_CHOICE,1,INACTIVE,2025-12-15T08:12:11.214646+00:00,0.0
debe3086-1483-49ba-ad47-68ba6c8988f6,I can identify the root cause of problems.,SINGLE_CHOICE,1,INACTIVE,2025-12-15T08:12:11.214552+00:00,0.0
03e1b67e-8301-4ca4-ae97-6604a271410c,I consider potential consequences before making decisions.,SINGLE_CHOICE,1,INACTIVE,2025-12-15T08:12:11.214495+00:00,0.0
e6311775-fae5-441d-a104-43b1d271704c,I distinguish between facts and opinions in discussions.,SINGLE_CHOICE,1,INACTIVE,2025-12-15T08:12:11.214437+00:00,0.0
c215854d-4244-4ab2-aa9f-81fc8d2f32f6,I analyze problems systematically rather than jumping to conclusions.,SINGLE_CHOICE,1,INACTIVE,2025-12-15T08:12:11.214378+00:00,0.0
e3d1111a-61f9-48b6-8f8c-af7df8763968,I can identify logical fallacies in arguments.,SINGLE_CHOICE,1,INACTIVE,2025-12-15T08:12:11.214340+00:00,0.0
2ec4ad9f-2118-4ef1-928b-ff137e6afb06,I consider multiple perspectives before forming opinions.,SINGLE_CHOICE,1,INACTIVE,2025-12-15T08:12:11.214302+00:00,0.0
61471425-cbed-4d12-80df-64f9249f9980,I evaluate the credibility of information sources.,SINGLE_CHOICE,1,INACTIVE,2025-12-15T08:12:11.214264+00:00,0.0
72f05610-f48d-46f1-b0ad-61b6bc1f2c3c,I question assumptions before accepting them as truth.,SINGLE_CHOICE,1,INACTIVE,2025-12-15T08:12:11.214225+00:00,0.0
bcd76779-2039-4d6d-9cf4-bcd16cdeaf4b,I take ownership of my responsibilities and outcomes.,SINGLE_CHOICE,1,INACTIVE,2025-12-15T08:12:11.214187+00:00,0.0
95849c93-efca-4c8b-ab70-6b4c903a116c,I continuously look for ways to improve my skills and knowledge.,SINGLE_CHOICE,1,INACTIVE,2025-12-15T08:12:11.214148+00:00,0.0
2cf8d9cd-1a03-4dbd-84b1-7fbece502f44,I am reliable and follow through on commitments.,SINGLE_CHOICE,1,INACTIVE,2025-12-15T08:12:11.214110+00:00,0.0
13e2dbc8-214d-4258-b7fa-507aa4e95917,I maintain professional behavior in all work contexts.,SINGLE_CHOICE,1,INACTIVE,2025-12-15T08:12:11.214071+00:00,0.0
e93213bb-bfd8-477d-869c-4a0e878b4d20,I can work independently without constant supervision.,SINGLE_CHOICE,1,INACTIVE,2025-12-15T08:12:11.214033+00:00,0.0
bbfa9197-ad7f-408a-9cd2-b687d01611aa,I go beyond minimum requirements when working on projects.,SINGLE_CHOICE,1,INACTIVE,2025-12-15T08:12:11.213994+00:00,0.0
cb67cf04-49a2-4be0-bb5c-6495b0c66a9f,I am punctual for meetings and appointments.,SINGLE_CHOICE,1,INACTIVE,2025-12-15T08:12:11.213956+00:00,0.0
f32c111f-015b-45d5-a964-0c77ba162b2d,I maintain high standards for the quality of my work.,SINGLE_CHOICE,1,INACTIVE,2025-12-15T08:12:11.213917+00:00,0.0
51d5e63d-af0d-429c-8224-27f936681d9f,I take initiative without waiting for direction.,SINGLE_CHOICE,1,INACTIVE,2025-12-15T08:12:11.213879+00:00,0.0
3bf5c38b-a037-423d-aa3d-d8a77ef5d673,I consistently meet deadlines for my work.,SINGLE_CHOICE,1,INACTIVE,2025-12-15T08:12:11.213841+00:00,0.0
d8d4ab6d-7626-480f-859f-b284f183635e,I believe that learning never stops in the technology field.,SINGLE_CHOICE,1,INACTIVE,2025-12-15T08:12:11.213802+00:00,0.0
aa4d0033-514b-487d-94f0-3521bb4d00aa,I enjoy teaching others what I have learned.,SINGLE_CHOICE,1,INACTIVE,2025-12-15T08:12:11.213764+00:00,0.0
0e16c7aa-9b1c-4018-87fc-49c9cb8e6ecb,I set personal learning goals beyond academic requirements.,SINGLE_CHOICE,1,INACTIVE,2025-12-15T08:12:11.213725+00:00,0.0
14e6d834-c92b-4f4e-a7b5-d9eb4d94d721,I seek feedback to identify areas for improvement.,SINGLE_CHOICE,1,INACTIVE,2025-12-15T08:12:11.213686+00:00,0.0
c51c12a7-d6f4-48c4-99de-d780134531a2,"I attend tech meetups, conferences, or webinars when possible.",SINGLE_CHOICE,1,INACTIVE,2025-12-15T08:12:11.213647+00:00,0.0
9316da87-68f0-4a40-8f80-86779c873bf6,I experiment with new tools and technologies in personal projects.,SINGLE_CHOICE,1,INACTIVE,2025-12-15T08:12:11.213607+00:00,0.0
6a27f43b-e8ac-43b4-9544-35e701c62f80,I follow industry leaders and influencers in my field.,SINGLE_CHOICE,1,INACTIVE,2025-12-15T08:12:11.213568+00:00,0.0
cf204778-c53e-4976-be5a-33cc425a2ad1,I participate in online courses or workshops beyond formal education.,SINGLE_CHOICE,1,INACTIVE,2025-12-15T08:12:11.213528+00:00,0.0
f8e6b9c9-08ff-43d0-a800-cd159b2fe496,I enjoy learning new programming languages or frameworks.,SINGLE_CHOICE,1,INACTIVE,2025-12-15T08:12:11.213487+00:00,0.0
6b960094-6bc7-4e5b-85ae-a3d0ad28c1f5,I regularly read technical articles or blogs to stay updated.,SINGLE_CHOICE,1,INACTIVE,2025-12-15T08:12:11.213426+00:00,0.0
891846cb-deed-4fa2-9abe-4995d0cfc55d,I learn from completed projects to improve future planning.,SINGLE_CHOICE,1,INACTIVE,2025-12-15T08:12:11.213359+00:00,0.0
06f6a708-c6c3-4f51-ad41-c264f8163600,I set realistic expectations for what I can accomplish.,SINGLE_CHOICE,1,INACTIVE,2025-12-15T08:12:11.213288+00:00,0.0
